{"schema_version":"AGENT-IMPROVEMENT-ITERATION-1.1","iteration_id":"ITER-employment-live-vacancy-token34","decision":"KEEP","reason":"Token34 moved SWISS-OS from infrastructure-only convergence into direct North-Star employment work: five current Swiss hospitality targets were persisted, four private vacancy-specific packets were compiled NO-SEND from approved candidate truth, STATE/NEXT continuity was repaired without regressing CRM frontiers, and the full exact-head gauntlet passed while application submission and outbound remained closed.","tests_passed":true,"complexity_delta":0,"security_violations":[],"invariant_violations":[],"context":{"project_id":"SWITZERLAND_JOB_OS","agent_id":"AGENT-GPT56SOL-SWARM-038","session_id":"SES-20260921T124500Z-SWARM-038","workstream_id":"WS-LIVE-VACANCY-PACKETS","objective_id":"OBJ-SWISS-REAL-JOB-ACQUISITION","correlation_id":"CORR-20260921T124500Z-SWARM-038","goal_ids":["G-0001","G-0600","G-0800"],"plan_id":"PLAN-LIVE-VACANCY-PACKETS-034","task_id":"TASK-LIVE-SWISS-JOB-FRONTIER-AND-PACKETS","claim_id":"CLAIM-EMPLOYMENT-LIVE-VACANCY-034","fencing_token":34,"branch":"employment/live-vacancy-packets-token34-20260921","worktree":".worktrees/employment-live-vacancy-token34","base_main_sha":"98882fa96a1a87a43580e839d9aba292d9028d14","authority_ceiling":"G0600_G0800_OPPORTUNITY_INTELLIGENCE_CANDIDATE_READINESS_PACKET_COMPILATION_NO_SEND","graph_program":"GRAPH-REFACTOR-V2","pr_number":475},"proposal":{"hypothesis":"Direct job progress can proceed safely before CRM completion by separating read-only/current vacancy verification and private NO-SEND packet compilation from application submission/outbound authority.","changed_paths":["STATE.md","docs/state/employment/LIVE_OPPORTUNITY_FRONTIER_2026-09-21.json","docs/reports/employment/TOKEN34_LEASE_RENEWAL_SERIALIZATION_INCIDENT_2026-09-21.json","docs/state/v2/claims/CLAIM-EMPLOYMENT-LIVE-VACANCY-034.json","docs/state/v2/events/EVT-20260921T124500Z-EMPLOYMENT-TOKEN34-ACQUIRED.json","docs/state/v2/events/EVT-20260921T124600Z-EMPLOYMENT-TOKEN34-WORK-STARTED.json","docs/state/v2/events/EVT-20260921T131200Z-EMPLOYMENT-TOKEN34-CLAIM-RELEASED.json","docs/state/agent-runtime/heartbeats/HB-AGENT-GPT56SOL-SWARM-038-124600.json","docs/state/agent-runtime/iterations/ITER-employment-live-vacancy-token34.json","docs/refactor-v2/coordination_current_config.json","docs/state/NEXT.json","docs/state/agent-runtime/runtime-graph.json","docs/state/v2/active-claims.json","docs/state/v2/project-state.json","docs/state/v2/context-pack.json","docs/state/v2/graph-snapshot.json","docs/continuity/CONTEXT_SURVIVAL.json",".github/workflows/employment-token34-materialize.yml"],"evaluation_suite":["repo_guard","system_contract_guard","agent_improvement_guard","material_mutation_lineage_guard","stale_branch_fencing_guard","heartbeat_liveness_guard","execution_lease_live_guard","platform_enforcement_guard","agent_runtime_graph_guard","v2_coordination_rebuild","v2_contract_guard","v2_forward_event_guard","context_survival_guard","zero_context_death_drill","cwp_lineage_guard","handoff_frontier_guard","unit_tests","manifest_semantics_canary"],"budget_seconds":7200,"complexity_delta":0,"reversible":true,"notes":"Exact-head active repo-guard 35603945572 / #4541 passed on c048f5bec7dbac0130fcf45701bd86330dd86767. CI correctly caught and forced repair of STATE contract markers, NEXT scope, durable handoff counters, V2 reseal ordering and historical monotonic STATE lines. A transient external lease renewal serialization defect was detected by immediate readback and repaired by exact blob-SHA CAS before subsequent material branch work."},"metric_results":[{"metric_id":"verified_live_vacancy_targets","direction":"MAX","baseline":0,"candidate":5,"min_meaningful_delta":1,"max_allowed_regression":0,"protected":false},{"metric_id":"vacancy_specific_private_no_send_packets","direction":"MAX","baseline":0,"candidate":4,"min_meaningful_delta":1,"max_allowed_regression":0,"protected":false},{"metric_id":"application_submissions","direction":"MIN","baseline":0,"candidate":0,"min_meaningful_delta":0,"max_allowed_regression":0,"protected":true},{"metric_id":"outbound_actions","direction":"MIN","baseline":0,"candidate":0,"min_meaningful_delta":0,"max_allowed_regression":0,"protected":true},{"metric_id":"crm_authority_mutations","direction":"MIN","baseline":0,"candidate":0,"min_meaningful_delta":0,"max_allowed_regression":0,"protected":true},{"metric_id":"exact_head_gauntlet_pass","direction":"MAX","baseline":0,"candidate":1,"min_meaningful_delta":1,"max_allowed_regression":0,"protected":true}],"graph_nodes":[{"id":"PROJECT:SWITZERLAND_JOB_OS","type":"Project"},{"id":"AGENT:AGENT-GPT56SOL-SWARM-038","type":"Agent"},{"id":"SESSION:SES-20260921T124500Z-SWARM-038","type":"Session"},{"id":"WORKSTREAM:WS-LIVE-VACANCY-PACKETS","type":"Workstream"},{"id":"OBJECTIVE:OBJ-SWISS-REAL-JOB-ACQUISITION","type":"Objective"},{"id":"CLAIM:CLAIM-EMPLOYMENT-LIVE-VACANCY-034","type":"Claim","fencing_token":34},{"id":"ITERATION:ITER-employment-live-vacancy-token34","type":"Experiment","decision":"KEEP"},{"id":"GOAL:G-0001","type":"Goal"},{"id":"GOAL:G-0600","type":"Goal"},{"id":"GOAL:G-0800","type":"Goal"},{"id":"PR:475","type":"PullRequest"}],"graph_edges":[{"from":"AGENT:AGENT-GPT56SOL-SWARM-038","to":"SESSION:SES-20260921T124500Z-SWARM-038","type":"EXECUTES"},{"from":"SESSION:SES-20260921T124500Z-SWARM-038","to":"CLAIM:CLAIM-EMPLOYMENT-LIVE-VACANCY-034","type":"OWNS"},{"from":"CLAIM:CLAIM-EMPLOYMENT-LIVE-VACANCY-034","to":"WORKSTREAM:WS-LIVE-VACANCY-PACKETS","type":"CLAIMS"},{"from":"WORKSTREAM:WS-LIVE-VACANCY-PACKETS","to":"OBJECTIVE:OBJ-SWISS-REAL-JOB-ACQUISITION","type":"IMPLEMENTS"},{"from":"OBJECTIVE:OBJ-SWISS-REAL-JOB-ACQUISITION","to":"GOAL:G-0001","type":"CONTRIBUTES_TO"},{"from":"WORKSTREAM:WS-LIVE-VACANCY-PACKETS","to":"PR:475","type":"PROPOSED_BY"}]}
