{"complexity_delta":0,"context":{"agent_id":"AGENT-GPT56SOL-GRAPHV2-001","authority_ceiling":"AGENT_RUNTIME_GRAPH_COORDINATION_ONLY_NO_DOMAIN_OR_EXTERNAL_MUTATION","base_main_sha":"46b165507b86b3da16b5885302a14b73105fc89d","branch":"feat/agent-runtime-graph-token12","claim_id":"CLAIM-GRAPHV2-AGENT-RUNTIME-012","correlation_id":"CORR-20260901T222000Z-AGENT-RUNTIME-012","fencing_token":12,"goal_ids":["G-0001"],"graph_program":"GRAPH-REFACTOR-V2","objective_id":"OBJ-AGENT-RUNTIME-GRAPH-ACTIVATION","plan_id":"PLAN-GRAPHV2-AGENT-RUNTIME-001","pr_number":433,"project_id":"SWITZERLAND_JOB_OS","session_id":"SES-20260901T222000Z-GRAPHV2-AGENT-RUNTIME-012","task_id":"TASK-AGENT-RUNTIME-GRAPH-001","workstream_id":"WS-AGENT-RUNTIME-GRAPH","worktree":".worktrees/agent-runtime-graph-token12"},"decision":"KEEP","graph_edges":[{"from":"AGENT:AGENT-GPT56SOL-GRAPHV2-001","to":"SESSION:SES-20260901T222000Z-GRAPHV2-AGENT-RUNTIME-012","type":"EXECUTES"},{"from":"SESSION:SES-20260901T222000Z-GRAPHV2-AGENT-RUNTIME-012","to":"WORKSTREAM:WS-AGENT-RUNTIME-GRAPH","type":"EXECUTES"},{"from":"WORKSTREAM:WS-AGENT-RUNTIME-GRAPH","to":"OBJECTIVE:OBJ-AGENT-RUNTIME-GRAPH-ACTIVATION","type":"IMPLEMENTS"},{"from":"PLAN:PLAN-GRAPHV2-AGENT-RUNTIME-001","to":"TASK:TASK-AGENT-RUNTIME-GRAPH-001","type":"CONTAINS"},{"from":"TASK:TASK-AGENT-RUNTIME-GRAPH-001","to":"ITERATION:ITER-fc4c2a920b88f86ba2e2","type":"TESTED_BY"},{"from":"CLAIM:CLAIM-GRAPHV2-AGENT-RUNTIME-012","to":"TASK:TASK-AGENT-RUNTIME-GRAPH-001","type":"CLAIMS"},{"from":"SESSION:SES-20260901T222000Z-GRAPHV2-AGENT-RUNTIME-012","to":"CLAIM:CLAIM-GRAPHV2-AGENT-RUNTIME-012","type":"OWNS"},{"from":"WORKTREE:.worktrees/agent-runtime-graph-token12","to":"BRANCH:feat/agent-runtime-graph-token12","type":"CHECKS_OUT"},{"from":"ITERATION:ITER-fc4c2a920b88f86ba2e2","to":"BRANCH:feat/agent-runtime-graph-token12","type":"EXECUTED_ON"},{"from":"TASK:TASK-AGENT-RUNTIME-GRAPH-001","to":"GOAL:G-0001","type":"CONTRIBUTES_TO"},{"from":"BRANCH:feat/agent-runtime-graph-token12","to":"PR:433","type":"PROPOSED_BY"},{"from":"ITERATION:ITER-fc4c2a920b88f86ba2e2","to":"FILE:src/swiss_os/agent_improvement_runtime.py","type":"MODIFIES"},{"from":"ITERATION:ITER-fc4c2a920b88f86ba2e2","to":"FILE:src/swiss_os/agent_runtime_graph.py","type":"MODIFIES"},{"from":"ITERATION:ITER-fc4c2a920b88f86ba2e2","to":"FILE:scripts/rebuild_agent_runtime_graph.py","type":"MODIFIES"},{"from":"ITERATION:ITER-fc4c2a920b88f86ba2e2","to":"FILE:scripts/context_survival_guard.py","type":"MODIFIES"},{"from":"ITERATION:ITER-fc4c2a920b88f86ba2e2","to":"FILE:docs/state/NEXT.json","type":"MODIFIES"},{"from":"ITERATION:ITER-fc4c2a920b88f86ba2e2","to":"FILE:docs/state/agent-runtime/runtime-graph.json","type":"MODIFIES"},{"from":"ITERATION:ITER-fc4c2a920b88f86ba2e2","to":"FILE:docs/continuity/CONTEXT_SURVIVAL.json","type":"MODIFIES"},{"from":"ITERATION:ITER-fc4c2a920b88f86ba2e2","to":"FILE:.github/workflows/repo-guard.yml","type":"MODIFIES"}],"graph_nodes":[{"id":"PROJECT:SWITZERLAND_JOB_OS","type":"Project"},{"id":"AGENT:AGENT-GPT56SOL-GRAPHV2-001","type":"Agent"},{"id":"SESSION:SES-20260901T222000Z-GRAPHV2-AGENT-RUNTIME-012","type":"Session"},{"id":"WORKSTREAM:WS-AGENT-RUNTIME-GRAPH","type":"Workstream"},{"id":"OBJECTIVE:OBJ-AGENT-RUNTIME-GRAPH-ACTIVATION","type":"Objective"},{"id":"PLAN:PLAN-GRAPHV2-AGENT-RUNTIME-001","type":"Plan"},{"id":"TASK:TASK-AGENT-RUNTIME-GRAPH-001","type":"Task"},{"fencing_token":12,"id":"CLAIM:CLAIM-GRAPHV2-AGENT-RUNTIME-012","type":"Claim"},{"id":"WORKTREE:.worktrees/agent-runtime-graph-token12","type":"Worktree"},{"id":"BRANCH:feat/agent-runtime-graph-token12","type":"Branch"},{"decision":"KEEP","id":"ITERATION:ITER-fc4c2a920b88f86ba2e2","type":"Experiment"},{"id":"GOAL:G-0001","type":"Goal"},{"id":"PR:433","type":"PullRequest"},{"id":"FILE:src/swiss_os/agent_improvement_runtime.py","type":"File"},{"id":"FILE:src/swiss_os/agent_runtime_graph.py","type":"File"},{"id":"FILE:scripts/rebuild_agent_runtime_graph.py","type":"File"},{"id":"FILE:scripts/context_survival_guard.py","type":"File"},{"id":"FILE:docs/state/NEXT.json","type":"File"},{"id":"FILE:docs/state/agent-runtime/runtime-graph.json","type":"File"},{"id":"FILE:docs/continuity/CONTEXT_SURVIVAL.json","type":"File"},{"id":"FILE:.github/workflows/repo-guard.yml","type":"File"}],"invariant_violations":[],"iteration_id":"ITER-fc4c2a920b88f86ba2e2","metric_results":[{"baseline":0.0,"candidate":1.0,"direction":"MAX","max_allowed_regression":0.0,"metric_id":"death_safe_runtime_recovery","min_meaningful_delta":0.5,"protected":false},{"baseline":0.0,"candidate":0.0,"direction":"MIN","max_allowed_regression":0.0,"metric_id":"authority_mutations","min_meaningful_delta":0.0,"protected":true},{"baseline":0.0,"candidate":0.0,"direction":"MIN","max_allowed_regression":0.0,"metric_id":"outbound_actions","min_meaningful_delta":0.0,"protected":true}],"proposal":{"budget_seconds":7200,"changed_paths":["src/swiss_os/agent_improvement_runtime.py","src/swiss_os/agent_runtime_graph.py","scripts/rebuild_agent_runtime_graph.py","scripts/context_survival_guard.py","docs/state/NEXT.json","docs/state/agent-runtime/runtime-graph.json","docs/continuity/CONTEXT_SURVIVAL.json",".github/workflows/repo-guard.yml"],"complexity_delta":0,"evaluation_suite":["agent_runtime_graph_guard","v2_coordination_rebuild","context_survival_guard","zero_context_death_drill","unit_tests_568","manifest_semantics_canary"],"hypothesis":"A deterministic Agent Runtime Graph plus self-contained heartbeats and durable iteration receipts makes active agent work recoverable after agent death without widening ownership or domain authority.","notes":"Qualified by GitHub Actions repo-guard run 33593256476 on PR #433 head 60460141c9812bb9c5a8d215dbbb1a8813370338; all guards, 568 unit tests, and manifest canary passed.","reversible":true},"reason":"material improvement: death_safe_runtime_recovery","schema_version":"AGENT-IMPROVEMENT-ITERATION-1.1","security_violations":[],"tests_passed":true}
